CREATE TABLE UNIVERSITY (
    university_id INT PRIMARY KEY,
    name VARCHAR(100) NOT NULL
);
INSERT INTO UNIVERSITY (university_id, name) VALUES  (1, 'Example University');
INSERT INTO UNIVERSITY (university_id, name) VALUES  (2, 'Another University');
INSERT INTO UNIVERSITY (university_id, name) VALUES  (3, 'Third University');
INSERT INTO UNIVERSITY (university_id, name) VALUES  (4, 'Fourth University');
INSERT INTO UNIVERSITY (university_id, name) VALUES  (5, 'Fifth University');
INSERT INTO UNIVERSITY (university_id, name) VALUES (6, 'Sixth University');
INSERT INTO UNIVERSITY (university_id, name) VALUES  (7, 'Seventh University');



CREATE TABLE DEPARTMENT (
    dept_id INT PRIMARY KEY,
    name VARCHAR(50) NOT NULL,
    building VARCHAR(50),
    budget DECIMAL(12, 2),
    university_id INT,
    FOREIGN KEY (university_id) REFERENCES UNIVERSITY(university_id)
);
INSERT INTO DEPARTMENT (dept_id, name, building, budget, university_id) VALUES 
(1, 'Computer Science', 'Taylor', 100000, 1);
INSERT INTO DEPARTMENT (dept_id, name, building, budget, university_id) VALUES 
(2, 'Mathematics', 'Watson', 90000, 1);
INSERT INTO DEPARTMENT (dept_id, name, building, budget, university_id) VALUES 
(3, 'Physics', 'Newton', 95000, 1);
INSERT INTO DEPARTMENT (dept_id, name, building, budget, university_id) VALUES 
(4, 'Biology', 'Darwin', 85000, 1);
INSERT INTO DEPARTMENT (dept_id, name, building, budget, university_id) VALUES 
(5, 'Chemistry', 'Curie', 92000, 1);
INSERT INTO DEPARTMENT (dept_id, name, building, budget, university_id) VALUES 
(6, 'English', 'Shakespeare', 80000, 1);
INSERT INTO DEPARTMENT (dept_id, name, building, budget, university_id) VALUES 
(7, 'History', 'Roosevelt', 78000, 1);
CREATE TABLE INSTRUCTOR (
    instructor_id NUMBER PRIMARY KEY,
    name VARCHAR2(50) NOT NULL,
    dept_id NUMBER,
    is_hod CHAR(1) DEFAULT 'N' CHECK (is_hod IN ('Y', 'N')),
    salary NUMBER(10, 2),
    CONSTRAINT fk_instructor_dept
        FOREIGN KEY (dept_id)
        REFERENCES DEPARTMENT(dept_id)
);
INSERT INTO INSTRUCTOR (instructor_id, name, dept_id, is_hod, salary)
VALUES (1, 'John Doe', 1, 'Y', 80000);
INSERT INTO INSTRUCTOR (instructor_id, name, dept_id, is_hod, salary)
VALUES (2, 'Jane Smith', 1, 'N', 75000);
INSERT INTO INSTRUCTOR (instructor_id, name, dept_id, is_hod, salary)
VALUES (3, 'Bob Johnson', 2, 'Y', 82000);
INSERT INTO INSTRUCTOR (instructor_id, name, dept_id, is_hod, salary)
VALUES (4, 'Alice Brown', 2, 'N', 76000);
INSERT INTO INSTRUCTOR (instructor_id, name, dept_id, is_hod, salary)
VALUES (5, 'Charlie Davis', 3, 'Y', 81000);
INSERT INTO INSTRUCTOR (instructor_id, name, dept_id, is_hod, salary)
VALUES (6, 'Eva Wilson', 3, 'N', 77000);
INSERT INTO INSTRUCTOR (instructor_id, name, dept_id, is_hod, salary)
VALUES (7, 'Frank Miller', 4, 'Y', 79000);




CREATE TABLE COURSE (
    course_id VARCHAR(8) PRIMARY KEY,
    title VARCHAR(100) NOT NULL,
    dept_id INT,
    credits INT,
    FOREIGN KEY (dept_id) REFERENCES DEPARTMENT(dept_id)
);

INSERT INTO COURSE (course_id, title, dept_id, credits) VALUES 
('CS-101', 'Introduction to Programming', 1, 3);
INSERT INTO COURSE (course_id, title, dept_id, credits) VALUES 
('CS-201', 'Data Structures', 1, 4);
INSERT INTO COURSE (course_id, title, dept_id, credits) VALUES 
('MATH-101', 'Calculus I', 2, 4);
INSERT INTO COURSE (course_id, title, dept_id, credits) VALUES 
('MATH-201', 'Linear Algebra', 2, 3);
INSERT INTO COURSE (course_id, title, dept_id, credits) VALUES 
('PHY-101', 'Mechanics', 3, 4);
INSERT INTO COURSE (course_id, title, dept_id, credits) VALUES 
('PHY-201', 'Quantum Physics', 3, 4);
INSERT INTO COURSE (course_id, title, dept_id, credits) VALUES 
('BIO-101', 'Introduction to Biology', 4, 4);



CREATE TABLE SECTION (
    section_id INT PRIMARY KEY,
    course_id VARCHAR(8),
    sec_id INT,
    semester VARCHAR(6),
    year INT,
    building VARCHAR(50),
    room_number VARCHAR(10),
    time_slot_id VARCHAR(4),
    FOREIGN KEY (course_id) REFERENCES COURSE(course_id)
);

INSERT INTO SECTION (section_id, course_id, sec_id, semester, year, building, room_number, time_slot_id) VALUES  (1, 'CS-101', 1, 'Fall', 2023, 'Taylor', '3128', 'A');
INSERT INTO SECTION (section_id, course_id, sec_id, semester, year, building, room_number, time_slot_id) VALUES (2, 'CS-201', 1, 'Spring', 2024, 'Taylor', '3114', 'B');
INSERT INTO SECTION (section_id, course_id, sec_id, semester, year, building, room_number, time_slot_id) VALUES (3, 'MATH-101', 1, 'Fall', 2023, 'Watson', '2230', 'C');
INSERT INTO SECTION (section_id, course_id, sec_id, semester, year, building, room_number, time_slot_id) VALUES (4, 'MATH-201', 1, 'Spring', 2024, 'Watson', '2245', 'D');
INSERT INTO SECTION (section_id, course_id, sec_id, semester, year, building, room_number, time_slot_id) VALUES (5, 'PHY-101', 1, 'Fall', 2023, 'Newton', '1320', 'E');
INSERT INTO SECTION (section_id, course_id, sec_id, semester, year, building, room_number, time_slot_id) VALUES (6, 'PHY-201', 1, 'Spring', 2024, 'Newton', '1310', 'F');
INSERT INTO SECTION (section_id, course_id, sec_id, semester, year, building, room_number, time_slot_id) VALUES (7, 'BIO-101', 1, 'Fall', 2023, 'Darwin', '2110', 'G');



CREATE TABLE TEACHES (
    instructor_id INT,
    section_id INT,
    PRIMARY KEY (instructor_id, section_id),
    FOREIGN KEY (instructor_id) REFERENCES INSTRUCTOR(instructor_id),
    FOREIGN KEY (section_id) REFERENCES SECTION(section_id)
);
INSERT INTO TEACHES (instructor_id, section_id) VALUES (1, 1);
INSERT INTO TEACHES (instructor_id, section_id) VALUES (2, 2);
INSERT INTO TEACHES (instructor_id, section_id) VALUES (3, 3);
INSERT INTO TEACHES (instructor_id, section_id) VALUES (4, 4);
INSERT INTO TEACHES (instructor_id, section_id) VALUES (5, 5);
INSERT INTO TEACHES (instructor_id, section_id) VALUES (6, 6);
INSERT INTO TEACHES (instructor_id, section_id) VALUES (7, 7);




CREATE TABLE STUDENT (
    student_id INT PRIMARY KEY,
    name VARCHAR(50) NOT NULL,
    tot_cred INT
);
INSERT INTO STUDENT (student_id, name, tot_cred) VALUES (1, 'Mike Johnson', 60);
INSERT INTO STUDENT (student_id, name, tot_cred) VALUES (2, 'Sarah Lee', 45);
INSERT INTO STUDENT (student_id, name, tot_cred) VALUES (3, 'Tom Brown', 30);
INSERT INTO STUDENT (student_id, name, tot_cred) VALUES (4, 'Emily Davis', 75);
INSERT INTO STUDENT (student_id, name, tot_cred) VALUES (5, 'David Wilson', 90);
INSERT INTO STUDENT (student_id, name, tot_cred) VALUES (6, 'Lisa Anderson', 15);
INSERT INTO STUDENT (student_id, name, tot_cred) VALUES (7, 'Chris Taylor', 105);


CREATE TABLE TAKES (
    student_id INT,
    section_id INT,
    grade VARCHAR(2),
    PRIMARY KEY (student_id, section_id),
    FOREIGN KEY (student_id) REFERENCES STUDENT(student_id),
    FOREIGN KEY (section_id) REFERENCES SECTION(section_id)
);




INSERT INTO TAKES (student_id, section_id, grade) VALUES (1, 1, 'A');
INSERT INTO TAKES (student_id, section_id, grade) VALUES  (1, 3, 'B');
INSERT INTO TAKES (student_id, section_id, grade) VALUES (2, 2, 'A');
INSERT INTO TAKES (student_id, section_id, grade) VALUES (2, 4, 'B');
INSERT INTO TAKES (student_id, section_id, grade) VALUES (3, 1, 'B');
INSERT INTO TAKES (student_id, section_id, grade) VALUES  (3, 5, 'A');
INSERT INTO TAKES (student_id, section_id, grade) VALUES (4, 2, 'A'); 
INSERT INTO TAKES (student_id, section_id, grade) VALUES (4, 6, 'B');
INSERT INTO TAKES (student_id, section_id, grade) VALUES (5, 3, 'A');
INSERT INTO TAKES (student_id, section_id, grade) VALUES  (5, 7, 'A');
INSERT INTO TAKES (student_id, section_id, grade) VALUES (6, 4, 'B');
INSERT INTO TAKES (student_id, section_id, grade) VALUES  (6, 1, 'A');
INSERT INTO TAKES (student_id, section_id, grade) VALUES (7, 5, 'A');
INSERT INTO TAKES (student_id, section_id, grade) VALUES  (7, 2, 'B');




CREATE TABLE TIME_SLOT (
    time_slot_id VARCHAR2(4) PRIMARY KEY,
    day CHAR(1),
    start_time DATE,
    end_time DATE
);

INSERT INTO TIME_SLOT (time_slot_id, day, start_time, end_time)
VALUES ('A', 'M', TO_DATE('09:00', 'HH24:MI'), TO_DATE('10:30', 'HH24:MI'));

INSERT INTO TIME_SLOT (time_slot_id, day, start_time, end_time)
VALUES ('B', 'T', TO_DATE('10:30', 'HH24:MI'), TO_DATE('12:00', 'HH24:MI'));

INSERT INTO TIME_SLOT (time_slot_id, day, start_time, end_time)
VALUES ('C', 'W', TO_DATE('13:00', 'HH24:MI'), TO_DATE('14:30', 'HH24:MI'));

INSERT INTO TIME_SLOT (time_slot_id, day, start_time, end_time)
VALUES ('D', 'R', TO_DATE('15:00', 'HH24:MI'), TO_DATE('16:30', 'HH24:MI'));

INSERT INTO TIME_SLOT (time_slot_id, day, start_time, end_time)
VALUES ('E', 'F', TO_DATE('11:00', 'HH24:MI'), TO_DATE('12:30', 'HH24:MI'));

INSERT INTO TIME_SLOT (time_slot_id, day, start_time, end_time)
VALUES ('F', 'M', TO_DATE('14:00', 'HH24:MI'), TO_DATE('15:30', 'HH24:MI'));


CREATE TABLE CLASSROOM (
    building VARCHAR(50),
    room_number VARCHAR(10),
    capacity INT,
    PRIMARY KEY (building, room_number)
);

INSERT INTO CLASSROOM (building, room_number, capacity) VALUES ('Taylor', '3128', 50);
INSERT INTO CLASSROOM (building, room_number, capacity) VALUES ('Taylor', '3114', 40);
INSERT INTO CLASSROOM (building, room_number, capacity) VALUES ('Watson', '2230', 60);
INSERT INTO CLASSROOM (building, room_number, capacity) VALUES ('Watson', '2245', 45);
INSERT INTO CLASSROOM (building, room_number, capacity) VALUES ('Newton', '1320', 55);
INSERT INTO CLASSROOM (building, room_number, capacity) VALUES ('Newton', '1310', 50);
INSERT INTO CLASSROOM (building, room_number, capacity) VALUES ('Darwin', '2110', 40);

SQL> update instructor set salary = salary * 10/100
  2  where dept_id = (select dept_id from department where name  = 'Computer Science');

2 rows updated.

SQL> update instructor set salary =  salary + salary * 10/100 where dept_id = (select dept_id from department where name  = 'Computer Science');

2 rows updated.

SQL> select * from instructor;

INSTRUCTOR_ID NAME                                                  DEPT_ID I
------------- -------------------------------------------------- ---------- -
    SALARY
----------
            1 John Doe                                                    1 Y
      8800

            2 Jane Smith                                                  1 N
      8250

            3 Bob Johnson                                                 2 Y
     82000


INSTRUCTOR_ID NAME                                                  DEPT_ID I
------------- -------------------------------------------------- ---------- -
    SALARY
----------
            4 Alice Brown                                                 2 N
     76000

            5 Charlie Davis                                               3 Y
     81000

            6 Eva Wilson                                                  3 N
     77000


INSTRUCTOR_ID NAME                                                  DEPT_ID I
------------- -------------------------------------------------- ---------- -
    SALARY
----------
            7 Frank Miller                                                4 Y
     79000


7 rows selected.

SQL> update instructor set salary =  salary + salary * 10/100 where dept_id = (select dept_id from department where name  = 'Mathematics');

2 rows updated.

SQL> update instructor set salary = salary + salary * 0.5 where salary < 80000;

4 rows updated.

SQL> select * from instructor;

INSTRUCTOR_ID NAME                                                  DEPT_ID I
------------- -------------------------------------------------- ---------- -
    SALARY
----------
            1 John Doe                                                    1 Y
     13200

            2 Jane Smith                                                  1 N
     12375

            3 Bob Johnson                                                 2 Y
     90200


INSTRUCTOR_ID NAME                                                  DEPT_ID I
------------- -------------------------------------------------- ---------- -
    SALARY
----------
            4 Alice Brown                                                 2 N
     83600

            5 Charlie Davis                                               3 Y
     81000

            6 Eva Wilson                                                  3 N
    115500


INSTRUCTOR_ID NAME                                                  DEPT_ID I
------------- -------------------------------------------------- ---------- -
    SALARY
----------
            7 Frank Miller                                                4 Y
    118500


7 rows selected.

SQL> SELECT * FROM INSTRUCTOR;

INSTRUCTOR_ID NAME                                                  DEPT_ID I
------------- -------------------------------------------------- ---------- -
    SALARY
----------
            1 John Doe                                                    1 Y
     13200

            2 Jane Smith                                                  1 N
     12375

            3 Bob Johnson                                                 2 Y
     90200


INSTRUCTOR_ID NAME                                                  DEPT_ID I
------------- -------------------------------------------------- ---------- -
    SALARY
----------
            4 Alice Brown                                                 2 N
     83600

            5 Charlie Davis                                               3 Y
     81000

            6 Eva Wilson                                                  3 N
    115500


INSTRUCTOR_ID NAME                                                  DEPT_ID I
------------- -------------------------------------------------- ---------- -
    SALARY
----------
            7 Frank Miller                                                4 Y
    118500


7 rows selected.

SQL> structure course;
SP2-0734: unknown command beginning "structure ..." - rest of line ignored.
SQL> desc course;
 Name                                      Null?    Type
 ----------------------------------------- -------- ----------------------------
 COURSE_ID                                 NOT NULL VARCHAR2(8)
 TITLE                                     NOT NULL VARCHAR2(100)
 DEPT_ID                                            NUMBER(38)
 CREDITS                                            NUMBER(38)

SQL> insert into course (course_id, title, dept_id, credits)
  2  values('CS-001', 'Weekly Seminar', 1, 1);

1 row created.

SQL> select * from course;

COURSE_I
--------
TITLE
--------------------------------------------------------------------------------
   DEPT_ID    CREDITS
---------- ----------
CS-101
Introduction to Programming
         1          3

CS-201
Data Structures
         1          4

COURSE_I
--------
TITLE
--------------------------------------------------------------------------------
   DEPT_ID    CREDITS
---------- ----------

MATH-101
Calculus I
         2          4

MATH-201
Linear Algebra

COURSE_I
--------
TITLE
--------------------------------------------------------------------------------
   DEPT_ID    CREDITS
---------- ----------
         2          3

PHY-101
Mechanics
         3          4

PHY-201

COURSE_I
--------
TITLE
--------------------------------------------------------------------------------
   DEPT_ID    CREDITS
---------- ----------
Quantum Physics
         3          4

BIO-101
Introduction to Biology
         4          4


COURSE_I
--------
TITLE
--------------------------------------------------------------------------------
   DEPT_ID    CREDITS
---------- ----------
CS-001
Weekly Seminar
         1          1


8 rows selected.

SQL> insert into course (course_id, title, dept_id, credits) values('CS-006', 'Project Based Learning', 2, 3);

1 row created.

SQL> select * from course;

COURSE_I
--------
TITLE
--------------------------------------------------------------------------------
   DEPT_ID    CREDITS
---------- ----------
CS-101
Introduction to Programming
         1          3

CS-201
Data Structures
         1          4

COURSE_I
--------
TITLE
--------------------------------------------------------------------------------
   DEPT_ID    CREDITS
---------- ----------

MATH-101
Calculus I
         2          4

MATH-201
Linear Algebra

COURSE_I
--------
TITLE
--------------------------------------------------------------------------------
   DEPT_ID    CREDITS
---------- ----------
         2          3

PHY-101
Mechanics
         3          4

PHY-201

COURSE_I
--------
TITLE
--------------------------------------------------------------------------------
   DEPT_ID    CREDITS
---------- ----------
Quantum Physics
         3          4

BIO-101
Introduction to Biology
         4          4


COURSE_I
--------
TITLE
--------------------------------------------------------------------------------
   DEPT_ID    CREDITS
---------- ----------
CS-001
Weekly Seminar
         1          1

CS-006
Project Based Learning
         2          3

COURSE_I
--------
TITLE
--------------------------------------------------------------------------------
   DEPT_ID    CREDITS
---------- ----------


9 rows selected.

SQL> set linesize 150;
SQL> select * from UNIVERSITY;

UNIVERSITY_ID NAME
------------- ----------------------------------------------------------------------------------------------------
            1 Example University
            2 Another University
            3 Third University
            4 Fourth University
            5 Fifth University
            6 Sixth University
            7 Seventh University

7 rows selected.

SQL> select * from course;

COURSE_I TITLE                                                                                                   DEPT_ID    CREDITS
-------- ---------------------------------------------------------------------------------------------------- ---------- ----------
CS-101   Introduction to Programming                                                                                   1          3
CS-201   Data Structures                                                                                               1          4
MATH-101 Calculus I                                                                                                    2          4
MATH-201 Linear Algebra                                                                                                2          3
PHY-101  Mechanics                                                                                                     3          4
PHY-201  Quantum Physics                                                                                               3          4
BIO-101  Introduction to Biology                                                                                       4          4
CS-001   Weekly Seminar                                                                                                1          1
CS-006   Project Based Learning                                                                                        2          3

9 rows selected.


SQL> select max(dept_id) from department;

MAX(DEPT_ID)
------------
           7

SQL> create sequence emp_id with 1 incremenet by 1;
create sequence emp_id with 1 incremenet by 1
                       *
ERROR at line 1:
ORA-00933: SQL command not properly ended


SQL> create table emp(emp_id INT primary key, name varchar2(20));

Table created.

SQL> insert into emp (emp_id, name values (emp_sq.nextval, "1');
ERROR:
ORA-01740: missing double quote in identifier


SQL> insert into emp(emp_id, name) values (emp_sq.nextval, '2 a');
insert into emp(emp_id, name) values (emp_sq.nextval, '2 a')
                                      *
ERROR at line 1:
ORA-02289: sequence does not exist


SQL> insert into emp(emp_id, name) values (emp_sq.nextval, '3 a');
insert into emp(emp_id, name) values (emp_sq.nextval, '3 a')
                                      *
ERROR at line 1:
ORA-02289: sequence does not exist


SQL> insert into emp(emp_id, name) values (emp_sq.nextval, '4 A');
insert into emp(emp_id, name) values (emp_sq.nextval, '4 A')
                                      *
ERROR at line 1:
ORA-02289: sequence does not exist


SQL> insert into emp(emp_id, name) values (emp_sq.nextval, '5 D');
insert into emp(emp_id, name) values (emp_sq.nextval, '5 D')
                                      *
ERROR at line 1:
ORA-02289: sequence does not exist


SQL> insert into emp(emp_id, name) values (emp_sq.nextval, '6 FG');
insert into emp(emp_id, name) values (emp_sq.nextval, '6 FG')
                                      *
ERROR at line 1:
ORA-02289: sequence does not exist


SQL> insert into emp(emp_id, name) values (emp_sq.nextval, '7JKH');
insert into emp(emp_id, name) values (emp_sq.nextval, '7JKH')
                                      *
ERROR at line 1:
ORA-02289: sequence does not exist


SQL> insert into emp(emp_id, name) values (emp_sq.nextval, '8GHJ');
insert into emp(emp_id, name) values (emp_sq.nextval, '8GHJ')
                                      *
ERROR at line 1:
ORA-02289: sequence does not exist


SQL> insert into emp(emp_id, name) values (emp_sq.nextval, '9FGH');
insert into emp(emp_id, name) values (emp_sq.nextval, '9FGH')
                                      *
ERROR at line 1:
ORA-02289: sequence does not exist


SQL> insert into emp(emp_id, name) values (emp_sq.nextval, '10 ASDF');
insert into emp(emp_id, name) values (emp_sq.nextval, '10 ASDF')
                                      *
ERROR at line 1:
ORA-02289: sequence does not exist


SQL> insert into emp(emp_id, name) values (emp_sq.nextval, "1');
ERROR:
ORA-01740: missing double quote in identifier


SQL> insert into emp(emp_id, name) values (emp_sq.nextval, '2 a');
insert into emp(emp_id, name) values (emp_sq.nextval, '2 a')
                                      *
ERROR at line 1:
ORA-02289: sequence does not exist


SQL> insert into emp(emp_id, name) values (emp_sq.nextval, '3 a');
insert into emp(emp_id, name) values (emp_sq.nextval, '3 a')
                                      *
ERROR at line 1:
ORA-02289: sequence does not exist


SQL> insert into emp(emp_id, name) values (emp_sq.nextval, '4 A');
insert into emp(emp_id, name) values (emp_sq.nextval, '4 A')
                                      *
ERROR at line 1:
ORA-02289: sequence does not exist


SQL> insert into emp(emp_id, name) values (emp_sq.nextval, '5 D');
insert into emp(emp_id, name) values (emp_sq.nextval, '5 D')
                                      *
ERROR at line 1:
ORA-02289: sequence does not exist


SQL> insert into emp(emp_id, name) values (emp_sq.nextval, '6 FG');
insert into emp(emp_id, name) values (emp_sq.nextval, '6 FG')
                                      *
ERROR at line 1:
ORA-02289: sequence does not exist


SQL> insert into emp(emp_id, name) values (emp_sq.nextval, '7JKH');
insert into emp(emp_id, name) values (emp_sq.nextval, '7JKH')
                                      *
ERROR at line 1:
ORA-02289: sequence does not exist


SQL> insert into emp(emp_id, name) values (emp_sq.nextval, '8GHJ');
insert into emp(emp_id, name) values (emp_sq.nextval, '8GHJ')
                                      *
ERROR at line 1:
ORA-02289: sequence does not exist


SQL> insert into emp(emp_id, name) values (emp_sq.nextval, '9FGH');
insert into emp(emp_id, name) values (emp_sq.nextval, '9FGH')
                                      *
ERROR at line 1:
ORA-02289: sequence does not exist


SQL> slect * from table;
SP2-0734: unknown command beginning "slect * fr..." - rest of line ignored.
SQL> select * from emp;

no rows selected

SQL> create sequence emp_id with 1 incremenet by 1;
create sequence emp_id with 1 incremenet by 1
                       *
ERROR at line 1:
ORA-00933: SQL command not properly ended


SQL>
SQL> create sequence emp_sq with 1 incremenet by 1;
create sequence emp_sq with 1 incremenet by 1
                       *
ERROR at line 1:
ORA-00933: SQL command not properly ended


SQL>
SQL> create sequence emp_sq start with 1 incremenet by 1;
create sequence emp_sq start with 1 incremenet by 1
                                    *
ERROR at line 1:
ORA-00933: SQL command not properly ended


SQL> create sequence emp_sq start with 1 increment by 1;

Sequence created.

SQL> insert into emp(emp_id, name) values (emp_sq.nextval, '1');

1 row created.

SQL> insert into emp(emp_id, name) values (emp_sq.nextval, '2 a');

1 row created.

SQL> insert into emp(emp_id, name) values (emp_sq.nextval, '3 a');

1 row created.

SQL> insert into emp(emp_id, name) values (emp_sq.nextval, '4 A');

1 row created.

SQL> insert into emp(emp_id, name) values (emp_sq.nextval, '5 D');

1 row created.

SQL> insert into emp(emp_id, name) values (emp_sq.nextval, '6 FG');

1 row created.

SQL> insert into emp(emp_id, name) values (emp_sq.nextval, '7JKH');

1 row created.

SQL> insert into emp(emp_id, name) values (emp_sq.nextval, '8GHJ');

1 row created.

SQL> insert into emp(emp_id, name) values (emp_sq.nextval, '9FGH');

1 row created.

SQL> insert into emp(emp_id, name) values (emp_sq.nextval, '10 ASDF');

1 row created.

SQL> DROP SEQUENCE EMP_SQ;

Sequence dropped.

SQL> SELECT MAX(EMP_ID) FROM EMP;

MAX(EMP_ID)
-----------
         10

SQL> alter table emp add pincode into not null;
alter table emp add pincode into not null
                            *
ERROR at line 1:
ORA-00902: invalid datatype


SQL> alter table emp add pincode;
alter table emp add pincode
                    *
ERROR at line 1:
ORA-02263: need to specify the datatype for this column


SQL> alter table emp add pincode int;

Table altered.

SQL> insert into emp(emp_id, name) values (emp_sq.nextval, '1 AAA', 44000);
insert into emp(emp_id, name) values (emp_sq.nextval, '1 AAA', 44000)
            *
ERROR at line 1:
ORA-00913: too many values


SQL> insert into emp(emp_id, name, pincode) values (emp_sq.nextval, '1 AAA', 44000);
insert into emp(emp_id, name, pincode) values (emp_sq.nextval, '1 AAA', 44000)
                                               *
ERROR at line 1:
ORA-02289: sequence does not exist


SQL> insert into emp (emp_id, name, pincode) values (emp_sq.nextval, '1 AAA', 440008);
insert into emp (emp_id, name, pincode) values (emp_sq.nextval, '1 AAA', 440008)
                                                *
ERROR at line 1:
ORA-02289: sequence does not exist


SQL> select * from emp;

    EMP_ID NAME                    PINCODE
---------- -------------------- ----------
         1 1
         2 2 a
         3 3 a
         4 4 A
         5 5 D
         6 6 FG
         7 7JKH
         8 8GHJ
         9 9FGH
        10 10 ASDF

10 rows selected.

SQL> truncate table emp;

Table truncated.

SQL> DROP COLUMN PINOCDE;
DROP COLUMN PINOCDE
     *
ERROR at line 1:
ORA-00950: invalid DROP option


SQL> DROP COLUMN PINCODE;
DROP COLUMN PINCODE
     *
ERROR at line 1:
ORA-00950: invalid DROP option


SQL> DROP COLUMN pincode;
DROP COLUMN pincode
     *
ERROR at line 1:
ORA-00950: invalid DROP option


SQL> alter table emp;
alter table emp
              *
ERROR at line 1:
ORA-02210: no options specified for ALTER TABLE


SQL> alter table emp
  2  DROP COLUMN pincode;

Table altered.

SQL> altyer table emp
SP2-0734: unknown command beginning "altyer tab..." - rest of line ignored.
SQL> alter table emp
  2  add pincode int not null;

Table altered.

SQL> create sequence emp_sq start with 1 increment by 1;

Sequence created.

SQL> insert into emp (emp_id, name, pincode) values (emp_sq.nextval, '1 AAA', 440008);

1 row created.

SQL> select * from emp;

    EMP_ID NAME                    PINCODE
---------- -------------------- ----------
         1 1 AAA                    440008

SQL> alter table emp
  2  rename column name to emp_name;

Table altered.

SQL> select * from emp;

    EMP_ID EMP_NAME                PINCODE
---------- -------------------- ----------
         1 1 AAA                    440008

SQL> rename table emp to employee;
rename table emp to employee
       *
ERROR at line 1:
ORA-00903: invalid table name


SQL> rename emp to employee;

Table renamed.

SQL> commit;

Commit complete.
